"installing, wiki, zsh, early, master, raw"
"clone, git, env, zsh, github, https"
"wiki, themes, zsh, repository, master, external"
"tmux, attach, kill, session, tad, sessions"
"crusader, crusaderw, git, clone, env, zsh"
"probably, batch, convert, interactive, arg, automatically"
"skipping, launch, silent, yourself, restart, printf"
"clone, git, env, zsh, github, https"
"highlighting, session, syntax, highlight, autosuggest, highlighter"
"theme, random, themes, mythemes, 31mtheme, 31m"
"theme, shuffle, favlist, themes, process, ran"
"font, sans, color, italic, weight, open"
"machine, docker, repo, copy, script, git"
"kube, kubectl, context, config, contexts, aws"
"slurm, vmiheer, maintainer, tries, completion, github"
"cravacuore, trizen, damián, syu, sync, upgrading"
"packet, filter, def, interfaces, output, capture"
"maintainers, www, scottkidder, bilal, budhani, bilalbudhani"
"blt, best, linux, terminal, disclaimer, apt"
"fssl, wget, curl, clone, env, https"
"env, zsh"
"bazel, bazelbuild, autocomplete, repo, copy, script"
"clone, env, git, https, zsh"
"alias, prune, ensure, dot, init, status"
"tail, chsh, grep, shells, etc, sudo"
"theme, then, themes, zsh, exists, file"
"clone, env, git, https, zsh"
"candidates, random, theme, zsh"
"que, una, para, instalación, con, por"
"fssl, curl, wget, export, clone, https"
"terraform, workspace, expanding, prompt, choosen, place"
"clone, env, git, https, zsh"
"philips, screen, rbenv, export, ubuntu, eval"
"installed, check, zsh, command"
"fssl, wget, curl, clone, env, https"
"omztemp, dotfiles, zshrc, fssl, wget, template"
"themes, pure, wiki, powerlevel9k, zsh, custom"
"brand, fabrand, customized, clone, git, env"
"flow, finish, hotfix, release, git, feature"
"zshrc, pwd, cexport, export, sed, back"
"clone, env, git, https, zsh"
"error, env, submodule, failed, git, branch"
"wiki, themes, take, fssl, early, have"
"coucou, les, mis"
"submodule, submodules, git, echo, clone, init"
"dir, parts, custom, users, existed, autosuggestions"
"zsh, wget, wiki, robby, curl, ohmyz"
"highlighting, syntax, highlight, highlighter, styles, highlighters"
"wiki, installing, fssl, zsh, early, have"
"fssl, curl, clone, env, git, https"
"restart, bluetooth, daemon"
"bbob, bbbob, tail, chsh, clone, grep"
"installed, check, please, zsh, unset, printf"
"fssl, wget, curl, clone, env, https"
"host, ssh, port, groupname, hosts, sys"
"ifa, example, alternatives, addr, steve, ipv6"
"screen, ssh, agent, dorlandt, bart, written"
"genuine, genuinex, raw, githubusercontent, tools, master"
"update, updates, you, weeks, prompting, someone"
"compdump, compinit, zsh"
"fetch, fred, origin, master, stat, git"
"highlighting, syntax, highlight, highlighter, styles, highlighters"
"compdump, zdotdir, zcompdump, host, cache, short"
"install, modified, backed, guide, raw, githubusercontent"
"compdump, zdotdir, zcompdump, home, zsh"
"disable, update, prompt, env, zsh"
"grc, just, here, find, info, all"
"fssl, curl, wget, export, clone, https"
"now, installed, echo, zsh"
"chrome, markdown, system, ubuntu, omdp, plz"
"sfv, dotfiles, templates, zshrc, please, zsh"
"len, branch, tagname, hash, split, str"
"echo, please, themes, printf, wiki, shell"
"vagrant, tail, chsh, grep, shells, etc"
"val, eval, echo"
"vim, brew, fssl, installing, nerdtree, curl"
"custom, theme, zsh, host, themes, random"
"push, fork, master, git"
"point, docker, warp, software, points, npx"
"fork, wiki, important, zsh, ohmyz, installing"
"config, custom, bash, gls, lib, alias"
"clone, env, git, https, zsh"
"wget, fork, clone, env, source, home"
"comp, cword, words, compreply, complete, env"
"upstream, origin, git, remote, dir, fssl"
fork
"vim, template, solarized, advanced, manual, installation"
"alternative, curl, sudo, shell, install, https"
"tarball, archive, compression, tar, extract, bzip2"
"warp, ps1, local, point, then, zeus"
"backup, updating, push, master, printf, normal"
"vimrc, templates, zsh"
"disable, update, prompt, env, shell, zsh"
"shell, chsh, printf, change, cygwin, manually"
"git, popen, status, remote, prompt, staged"
"env, clone, git, zsh, https"
"point, warp, docker, software, points, machine"
"fssl, wget, curl, clone, env, https"
"envy, profile, profiles, bashrc, asciinema, default"
"frameslist, sed, echo, then"
"session, restore, shell, terminal, virtual, sessions"
"epoch, update, clone, env, last, echo"
"clone, git, env, zsh, github, https"
"hostname, submit, disable, auto, update, then"
"uncomment, zstyle, export, completion, alias, disable"
"swag, shop, planetargon, get, printf, bold"
"fssl, wget, curl, clone, env, https"
"clone, env, git, https, zsh"
"ps1, upstream, git, svn, local, head"
"alias, fpath, aliases, aliasdefs, base, zsh"
"vimrc, bashrc, tmux, bak, conf, pwd"
"emacsclient, alternate, frame, editor, create"
"jokes, sys, import, json, dir+', fortunesinetjokes"
"profile, rgb, key, dconf, val, slug"
"thorpora, personnal, screenshot, zsh, img, src"
"archive, tarball, tar, compression, zip, diki"
"theme, custom, ending, new, themes, would"
"fssl, wget, curl, clone, env, https"
"installed, check, please, zsh, unset, printf"
"wiki, themes, take, have, installing, fssl"
"rank, point, native, react, vim, template"
"uninstall, bash, system, run, revert, uninstalled"
"pacman, yaourt, repositories, package, update, sudo"
"remote, url, web, awk, grep, getversion"
"lrin, lrinqvq, fonts, powerline, install, raw"
"michael, one, theme, fssl, fanciest, simplest"
"wiki, themes, theme, take, have, installing"
"swiftpm, plugins, start, array, using, zshrc"
"mode, multilevel, navigate, stopped, improvements, incremental"
"powerlevel9k, segment, segments, icon, vcs, new"
"compdump, compinit, bypass, true, else, then"
"clone, env, git, https, zsh"
"clone, git, env, com, github, zsh"
"datafile, pwd, dirs, builtin, licensed, typ"
"replace, branch"
"fpath, load, stock, compaudit, compfix, functions"
"dserve, mystaticfolder, php, doc, docker, container"
"dir, updating, custom, stat, origin, master"
"clone, env, git, https, zsh"
"nothing, echo"
"val, key, line"
"upstream, git, instruction, fetch, master, push"
"mvncd, mvn, deploy, clean"
"fssl, wget, curl, clone, env, https"
"znt, tmux, ctrl, history, share, usr"
"export, ssh, niro, cargo, src, goroot"
"len, tagname, branch, hash, str, ahead"
"spot, atom, once, you, editor, initialization"
"stat, master, rebase, upstream, clone, git"
"finder, tab, split, itunes, spotify, control"
"custom, for"
"upstream, remote, stat, master, git, rebase"
"please, you, requests, search, luke, have"
"macos, linux, spot, powerline, you, host"
"clone, env, git, https, zsh"
"you, zsh, shell, themes, theme, once"
"self, highlighting, setuppy, def, highlight, syntax"
"git, fork, allow, unrelated, stat, histories"
"shengliang, opt, grep, shells, installed, home"
"snnbbbource, community, driven, framework, managing, org"
"svn, prompt, rev, branch, agnoster, caveats"
"fecs, format, sunbohong, maintainer, aliases, alias"
"epoch, update, then, lock, diff, line"
"git, clone, zsh, github, com"
"fssl, wget, curl, clone, env, https"
"whats, vagrant, currect, symbol, box, agnoster"
"chxia, export, theme, zsh"
zsh
"clone, env, git, https, zsh"
"installed, check, please, zsh, unset, printf"
"coffeescript, code"
"tail, chsh, grep, shells, etc, sudo"
"iron, ironhome, str, php, path, preg"
"highlight, highlighter, styles, highlighters, syntax, highlighting"
"clone, env, git, https, zsh"
"fssl, wget, curl, clone, env, https"
"finder, open, preview, return, quick, hidden"
"disable, update, prompt, auto, true, env"
"wiki, themes, theme, take, have, installing"
"package, 0m\e, packages, pacman, pacaur, tarball"
"lock, cancel, upgrade, remove, create, touch"
"gitpush, wdir, mweb, fswatch, proxy, blog"
"stat, fork, pull, master, git"
"flow, prefix, repo, gitflow, echo, install"
"disable, yarema, victor, cache, auto, update+x"
"clone, env, git, https, zsh"
"creset, maxlen, str, x09, done, head"
"master, origin, upstream, git, fssl, fetch"
"config, exclude, name, file, tip, continue"
"suggestion, widgets, menlo, autosuggest, autosuggestions, powerline"
"zelda, life, lvl, magix, sat, theme"
"highlight, styles, highlighters, highlighter, syntax, popen"
"compose, docker, repo, copy, script, git"
"frame, alternate, compose, create, editor, egrep"
"weqweqweqweqeqe, eqweqeqqwe"
"config, file, zsh, for"
"fab, du__, clone"
"highlighting, syntax, zplugin, history, word, multi"
"caveats, aims, vendor, getgb, such, usually"
"mvncisto, mvn, dskip, dskiptests, offline, tests"
"walkersneps, warning, intended, sync, machines, fork"
"clone, git, env, com, github, zsh"
"chsh, bin, zsh"
"master, upstream, git, fetch, push, checkout"
"session, autosuggest, end, content, widget, hello"
"bookmarker, mark, marking, marker, directory, bookmarking"
"kevintemplate, template, clone, env, zshrc, git"
"tasks, cron, cmd, task, import, def"
"indiegogo, flysonic10, maintainer, many, useful, functions"
"cygwin, tput, normal, printf, error, omztemp"
"jira, url, prefix, browser, issue, atlassian"
"custom, notify, env, zsh, bin, upgrades"
"len, tagname, branch, str, hash, ahead"
"now, installed, echo"
"showupstream, ps1, verbose, printf, format, local"
"noah, gamboa, edition, clone, now, env"
"highlighting, syntax, highlighter, highlight, styles, highlighters"
"installing, wiki, zsh, early, master, raw"
"theme, choose, count, declare, declare|typeset, randomly"
"clone, env, git, https, zsh"
"clone, env, git, https, zsh"
"meteor, ps1, mvn, git, znt, history"
"installing, fssl, zsh, curl, take, shit"
"volumes, macintosh, omztemp, zshrc, backing, normal"
"clone, env, git, https, zsh"
"clone, env, git, https, zsh"
"master, origin, updated, stat, push, commits"
"cache, foreground, echo, sed, txtblu, txtgry"
"you, stickers, clone, powerline, magic, planet"

"session, autosuggest, end, content, widget, hello"
"scan, subnets, nmap, ping, icmp, over"
"export, random, themes, theme"
"kirby, install, clear, make, kit, getkirby"
"word, delete, reverse, alt+backspace, instalation, asciinema"
"brew, update, custom, upgrade, line, would"
"forked, repo, robby, rebase, usr, env"
"head, pacman, yaourt, repositories"
"almostontop, insipred, asciinema, sergey, valiev, author"
"printf, please, shell, changed, manually, clone"
"foo, installed, null, check, dev, command"
"hostname, submit, disable, auto, update, then"
"please, idoo, term2, iterm2, depends, day"
hello
"docker, machine, stop, foobar, dev, call"
"tail, admin, chsh, clone, grep, shells"
"flags, noun, nonpersistent, kubectl, local, word"
"head, native, readme, react, master, linux"
"maricn, maintainer, custom, many, useful, functions"
"clone, env, git, https, zsh"
"clone, env, git, https, zsh"
"ipfs, please, inter, planetary, interplanetary, system"
"stat, master, rebase, upstream, pull, git"
"code, visual, studio, windows, linux, passed"
"ups, stat, master, rebase, pull, git"
"export, operation, fssl, darwin, linux, curl"
"shell, test, expr, current, then"
"source, then"
"cprint, color, grey, cheatsheet, attrs, print"
"timer, here, allows, sample, sleep, format"
"history, rank, substring, search, ember, dog"
"shell, whatever, zsh, installation, bin, amazonaws"
"font, echo, alternatively, terminal, weird, tail"
"cache, dir, update, zsh, migrate, epoch"
"highlighting, highlighters, syntax, highlighter, highlight, styles"
"module, datetime, zmodload, path, zsh, else"
"shell, expr, test, current"
"else, then"
"class, st0, path, xlink, st5, height"
"compinit, insecurities, compdump, completions, disable, else"
"software, virtualenv, terminal, linux, notifier, iterm2"
"cancel, whence, upgrade, git, system, return"
"drush, clear, drupal, sql, site, module"
"upstream, fetch, master, merge, git"
"tput, printf, head, cygwin, echo, normal"
"software, the"
"mrkva, lumir, clone, git, env, zsh"
"upstream, remote, git, fetch, master, merge"
"emoji, none, flag, text, face, 1f1e"
"printf, cygwin, normal, echo, tput, error"
"meteor, history, package, git, search, znt"
"printf, normal, echo, tput, blue, cwd"
"artisan, php, make, laravel, serve, controller"
"hash, clone, git, env, null, dev"
"shell, chsh, printf, change, env, normal"
"void, manager, voidlinux, especially, xbps, allow"
"shl, chsh, could, head, grep, change"
"hash, clone, git, env, null, dev"
"stat, master, upstream, pull, git"
"xcode, meteor, search, jira, git, history"
"head, usr, clone, git, env"
"hash, clone, git, env, null, dev"
"meteor, package, ps1, packages, mvn, git"
"highlight, styles, highlighter, highlighters, syntax, highlighting"
"hash, quiet, clone, been, git, env"
"grep, dpkg, 34minstalling, shell\033, installed, installing"
"pacaur, aur, repositories, package, synchronize, devel"
"invoker, gem, autocomplete, install, codemancers, mancers"
"point, docker, warp, software, points, npx"
"config, set, val, arr, point, key"
"hash, clone, git, env, null, dev"
"alberto, vagrant, host, vms, look, prompts"
"setuppy, python, build, install, _managepy, rpm"
"head, fssl, export, confirmation, readme"
"export, alias, path, pod, def, window"
"raw, githubusercontent, tools, master, fssl, wget"
"native, please, react, you, search, have"
"zwip, wip, zeus, cucumber, profile, aliases"
"upstream, remote, clone, setup, push, origin"
"34mcloning, cloning, master, git, echo, head"
"clone, env, git, https, zsh"
"git, hash, clone, env, null, dev"
"highlighters, highlight, highlighter, styles, syntax, highlighting"
"images, containers, shows, hobbes, imgur, applicable"
"pacman, yaourt, delete, repositories, package, sudo"
"clone, git, env, zsh, github, https"
"solarized, ansi, colors, dircolors, terminal, color"
"preview, compiled, coffeescript, shown, result, would"
"mark, update, epoch, zsh, last, return"
"points, warp, frontend, search, describe, pacman"
"git, hash, clone, env, null, dev"
"highlight, styles, highlighter, highlighters, syntax, highlighting"
"clone, env, git, https, zsh"
"chsh, grep, 34mtime, shell, 34m, time"
"stat, master, rebase, upstream, pull, git"
"hash, clone, git, env, null, dev"
"initializes, zsh"
"themes, theme, blacklisted, done, zsh, for"
"epoch, update, last, echo, zsh, current"
"submodule, git, fixme, 34minstall, 34m, hash"
"upstream, master, git, remote, clone, pull"
"explained, python, show, curl, curlj, curlh"
"hash, clone, git, env, null, dev"
"upstream, master, git, fetch, checkout, merge"
"data, dir, user, epoch, update, compdump"
"font, input, fonts, software, sans, stylistic"
"cjling, path, pwd, bash, bin, zshrc"
"theme, 95m, 91m, 94m, 93m, 92m"
"printf, cygwin, normal, echo, tput, error"
"hash, clone, git, env, null, dev"
"highlight, styles, highlighter, highlighters, syntax, highlighting"
"printf, master, upstream, git, origin, hooray"
"hash, clone, git, env, null, dev"
"hash, clone, git, env, null, dev"
"sublime, text, opening, folder, useful, called"
"cache, dir, sould, created, hash, set"
"bundle, bundler, gems, aliased, executable, wrapped"
"hash, clone, git, env, null, dev"
"hash, clone, git, env, null, dev"
"awesome, tailored, pro, source, powerline, requires"
"custom, theme, disable, then, update, zsh"
"export, sed, zsh"
"ssh, admin, addressorip, jacob, sudo, address"
"32mcustom, sh\033, zsh\033, 32m, hash, clone"
"exception, kraken, image, folder, string, protected"
"clone, git, env, com, github, zsh"
"stat, master, rebase, upstream, pull, git"
"percol, lambda, command, cancel, view, input"
"git, hash, clone, env, null, dev"
"color, charge, max, threshold, cur, out"
"command1, executed, epoch, operator, command2, sh环境下读取并执行file"
"bookmark, bookmarks, bashmarks, showmarks, foo, zshmarks"
"textile, src1, sublime, readme, text"
"custom, theme, load, fpath, host, zsh"
"hash, clone, git, env, null, dev"
"img, set, png, theme, zshrc, use"
"emoji, none, flag, text, face, 1f1e"
"git, hash, clone, env, null, dev"
"apt, hash, curl, usr, clone, git"
"space, elif, point"
"rank, datafile, fnd, matches, return, foo"
"taglist, tlist, window, vim, tag, explorer"
"wiki, themes, theme, take, have, installing"
"installing, linux, clone, error, mac, zsh"
"update, would, sytem, prelude, dotfiles, deleted"
"highlight, highlighter, highlighters, styles, syntax, highlighting"
"git, hash, clone, env, null, dev"
"upstream, git, pull, exocen, master, fetch"
"export, syntax"
"warp, points, search, point, highlight, highlighter"
"zzz, zcompile, done, unset, usr, theme"
"apt, sudo, get, upgrade, update, sag"
"point, msg, warp, theme, 95m, 91m"
"hash, clone, git, env, null, dev"
"virtualenv, pirate, bay, hour, relative, absolute"
"alternate, emacsclient, editor, frame, visible, safe"
"clone, git, env, zsh, github, https"
"powerline, see, creating, vim, symlink, info"
"points, warp, frontend, search, describe, sudo"
"date, echo"
"hash, usr, clone, git, env, bin"
"hash, usr, clone, git, env, bin"
"atom, linux, windows, config, custom, passed"
"hash, clone, git, env, null, dev"
"clone, git, env, zsh, github, https"
"master, stat, push, origin, upstream, git"
"stat, master, upstream, pull, git"
"emoji, none, flag, text, face, 1f1e"
"sourced, archive, move, custom, being, avoid"
"gradle, completion, cache, tasks, bash, build"
"storm, topology, cluster, launches, workers, zookeeper"
"fetch, origin, successful, git, attaching, installing"
"disable, update, prompt, auto, true, env"
"apt, configure, yes, ssh, askyesorno, ask"
"virtualenv, target, theme, prompt, customize, virtual"
"home, zshrc, zsh"
"stash, apply, git"
"highlight, highlighter, highlighters, styles, syntax, highlighting"
"themes, theme, removing, random, file, found"
"cache, created, set, dir, where, should"
"aledovsky, stat, origin, rebase, themes, pull"
"builtin, libs, config, changed, load, builtins"
"str, terminix, license, general, osc7, public"
"highlight, highlighter, highlighters, styles, syntax, highlighting"
"highlight, styles, highlighter, highlighters, syntax, highlighting"
"popen, communicate, remote, staged, branch, changed"
"installs, setup, avp, submodule, dir, git"
"git, templates, hash, clone, usr, env"
"mp3, shi, chi, tsu"
"disable, update, prompt, usr, env, bin"
"export, 256color, sbt, path, lime, mysql"
"removing, history, then, update, zshrc, hash"
zsh
"suggest, manually, printf, please, change, shell"
"disable, update, prompt, usr, auto, true"
"ohmyz, master, twitter, head, uninstall, upstream"
"highlight, highlighter, highlighters, styles, syntax, highlighting"
"emoji, none, flag, text, face, 1f1e"
"emoji, none, flag, face, 1f1e, text"
"markdown, post, enter, asdfasdf, baseurl, cis"
"config, custom, load, configurations, unset, file"
"hash, clone, git, env, null, dev"
"hash, usr, clone, git, env, bin"
"master, head, hash, upstream, usr, clone"
"uncomment, export, disable, yyyy, true, following"
"dircolors, coreutils, colors, libexec, manpath, norm"
"git, hash, clone, env, null, dev"
"target, path, zcompile, wget, bin, then"
"env, 34mtime, 34m, hash, chsh, clone"
"epoch, last, current"
"sys, utf, decode, error, version_info, output"
"git, hash, clone, usr, env, bin"
"emoji, none, flag, text, face, 1f1e"
"annex, git, somewhere, origin, python, clone"
"unlink, answer, yes, aliases, overwritten, zshrc"
"strategy, sublime, upstream, useful, text, sst"
"docker, contrib, slow, paste, upstream, autocomplete"
"self, container, terminal, terminator, import, gobject"
"highlight, highlighter, highlighters, styles, syntax, highlighting"
"curshell, prevshell, pre, shell, getent, dscl"
"fisiu, clone, git, env, zsh, github"
"s\033, 0m\n, 32m, printf, master, hooray"
"color, filled, slots, max, charge, math"
"history, rank, substring, search, ember, dog"
"pos, cmd, bold, self, arg, zle"
"highlight, highlighter, highlighters, styles, syntax, highlighting"
"dotfiles, fasd, install, fork, see, custom"
"hash, usr, clone, git, env, bin"
"defunct, fork, setup, longer, chsh, clone"
"nmap, apt, warp, scan, bgnotify, point"
"config, custom, load, configurations, hash, unset"
"master, git, fetch, hard, origin, checkout"
"highlight, highlighter, highlighters, styles, syntax, highlighting"
"old, stat, master, rebase, upstream, zsh"
"hash, usr, clone, git, env, bin"
"hash, usr, clone, git, env, bin"
"dotfiles, loads, location, symlink, localized, symlinking"
"grunt, maxim, kraev, maximkraev, software, wiki"
"git, hash, usr, clone, env, bin"
"sha1, unmerged, symbols, staged, untracked, ahead"
"clone, env, git, https, zsh"
"libignores, libignore, custom, load, grab, flagged"
"hash, clone, git, env, null, dev"
"scd, json, local, ps1, warp, then"
"configs, parts, host, subdomain, unset, domain"
"clone, git, env, zsh, github, https"
"sync, upstream, master, git, fetch, push"

"copy, theme, system, strict, zshrc, templates"
"s\033, 0m\n, printf, 32m, 34m, master"
"maintainer, bilal, budhani, bilalbudhani, www, http"
"highlight, highlighter, highlighters, styles, syntax, highlighting"
"plugins, spot, shell, getting, started, wget"
"highlight, highlighter, highlighters, styles, syntax, highlighting"
"alias, maintainer, addon, jhbuild, miguel, vaello"
"cancel, write, upgrade, permissions, return, does"
"basedir, 33myou, 33m, zsh, echo, template"

"popen, communicate, remote, staged, branch, changed"
"you, zsh, themes, contributors, take, updates"
"hash, usr, clone, git, env, bin"
"puppet, lair, robby, russell, feel, fpath"

"ckan, parts, path, part, sep, homedir"
"master, origin, pull, push, git, upstream"
"tim, install, zsh, based, pacman, aptitude"
"echo, usr, env, bin, 32m, hash"
"s\033, 0m\n, printf, 32m, upgrade, omz"
"hash, usr, clone, git, env, bin"
"target, path, home"
"color, battery, charge, filled, charging, slots"
"stat, master, upstream, pull, git"
"tlist, vim, taglist, ctrlp, buffer, dtree"
"warp, print, msg, shift, points, point"
"let, endif, groupnum, retv, syn, ansi"
"hash, clone, git, env, source, null"
"defaults, write, apple, bool, dock, com"
"printf, then, git, local, rank, history"
"hostname, host, short"
"stat, rebase, upstream, pull, master, git"
"highlight, highlighter, highlighters, styles, syntax, highlighting"
"git, hash, chsh, usr, clone, env"
"s\033, 0m\n, custom, printf, theme, zsh"
"warp, print, msg, shift, points, point"
"priv, conf, load, configs, privs, source"
"stat, master, rebase, upstream, pull, git"
"software, eread, head, compass, ps1, ps1pc"
"clone, bin, usr, env, syntax, git"
"argcount, myargs, api, _mt, message, word"
"32m, echo, wget, license, lab, scribenet"
"fino, hash, usr, clone, git, env"
"color, filled, slots, max, charge, math"
"setuppy, python, build, install, _managepy, rpm"
"hash, usr, clone, git, env, bin"
"ps1, upstream, svn, git, gitstring, local"
"theme, random, themes, source, custom, load"
"disable, update, prompt, auto, true, env"
"template, 33m, echo, zshrc, 33moh, plays"
"hash, clone, git, env, null, dev"
"warp, print, msg, software, shift, points"
"fnd, datafile, nocase, rank, return, wcase"
"hash, usr, clone, git, env, bin"

"frontend, shorthand, bundle, bundler, gems, search"

"git, prompt, popen, local, remote, status"
"ember, cli, install, eia, eib, bower"
"theme, source, custom, elif, zsh, themes"
"xterm, 256color, solarized, bit, terminal, settings"
"hash, usr, clone, git, env, bin"
"fpath, functions, completions, zsh"
"hash, usr, clone, git, env, bin"
"hash, usr, clone, git, env, bin"
"themes, dir"
"hash, usr, clone, git, env, bin"
"disable, auto, true, update"
"upstream, git, master, fetch, push, origin"
"profile, source"
"32m, echo, usr, 34m, bin, configured"
"grep, echo, vcs, theme, list_theme, lin"
"rank, fnd, datafile, matches, return, foo"
"vimrc, 34m, template, echo, 34mlooking, 33mfound"
"zeus, aliases, test, cucumber, unit, functional"
"droplr, argv, fabio, fernandes, shorten, app"
"sourcing, config, echo, file"
"master, upstream, pull, git"
"clone, env, git, https, zsh"
"highlight, highlighter, highlighters, styles, syntax, highlighting"
"34mnon, retardedly, refraining, coding, hard, echo"
"spot, once, initialization, you, favorite, like"
"fssl, wget, curl, clone, env, https"
"hash, usr, clone, git, env, bin"
"env, clone, usr, bin, git, zsh"
"warp, print, points, msg, fnd, point"
"hash, usr, clone, git, env, bin"
"fnd, datafile, nocase, rank, return, wcase"
"hash, clone, git, env, null, dev"
"hash, usr, clone, git, env, bin"
"highlight, highlighter, highlighters, styles, syntax, highlighting"
"native, react, cask, iphone, ios, simulator"
"clone, env, git, zshrc, https, zsh"
"submodule, usr, env, bin, git, hash"
"warp, print, points, msg, fnd, point"
"export, highlight, highlighter, highlighters, styles, syntax"
"master, rebase, upstream, pull, git"
"raw, githubusercontent, tools, master, fssl, wget"
"finder, native, react, tempfile, stdin, osx"
"hash, usr, clone, git, env, bin"
"home, symbolic, warning, creating, source, link"
"upstream, fetch, master, merge, git"
"hash, usr, clone, git, env, bin"
"bin, chsh, shell, else, which, then"
"hash, clone, git, env, null, dev"
"tablvl, fline, print, arr, split, control"
"hash, usr, clone, git, env, bin"
"warp, print, points, msg, fnd, point"
"shift, hbar, alias, color, altchar, time"
"option, name, value, fontcolor, color, solarized"
"warp, point, msg, print, points, config"
"stat, master, robby, rebase, pull, git"
"33myou, dirname, 33m, rsync, zsh, mkdir"
"session, autosuggest, end, content, widget, wait"
"hash, usr, clone, git, env, bin"
"git, hash, usr, clone, env, bin"
"hash, usr, clone, git, env, bin"
"retval, answer, break, please, necessarily, readonly"
"disable, update, auto, prompt, usr, true"
"config, custom, source, file, then, zsh"
"popen, remote, communicate, staged, branch, changed"
"config, custom, usr, clone, zsh, git"
"master, stat, push, origin, rebase, upstream"
"autoload, compinit"
"hash, usr, clone, git, env, bin"
"echo, 32m, zshrc, 34m, zsh, template"
"color, commit, codes, minutes, git, last"
"clone, env, git, https, zsh"
"highlight, highlighter, highlighters, styles, highlighting, syntax"
"highlight, highlighter, highlighters, styles, syntax, highlighting"
"s\033, 0m\n, upstream, printf, 32m, try"
"master, git, pull, path, current"
